{
  "$schema": "./protocol/schema/project-state.schema.json",
  "stateVersion": 1,
  "updatedAt": "2026-10-17",
  "engineVersion": "0.0.48",
  "activeMilestone": 18.3,
  "milestoneStatus": "in_progress",
  "completion": {
    "activeMilestonePercent": 70,
    "wholeProjectPercent": 94,
    "method": "docs/architecture/MILESTONE_REPORTING.md",
    "scopeNote": "Historical original weighted MVP 122/130; expanded API compatibility is additional unweighted scope."
  },
  "milestones": {
    "0": {
      "status": "complete",
      "percent": 100
    },
    "1": {
      "status": "complete",
      "percent": 100
    },
    "2": {
      "status": "complete",
      "percent": 100
    },
    "3": {
      "status": "complete",
      "percent": 100
    },
    "4": {
      "status": "complete",
      "percent": 100
    },
    "5": {
      "status": "complete",
      "percent": 100
    },
    "6": {
      "status": "complete",
      "percent": 100
    },
    "7": {
      "status": "complete",
      "percent": 100
    },
    "8": {
      "status": "complete",
      "percent": 100
    },
    "9": {
      "status": "complete",
      "percent": 100
    },
    "10": {
      "status": "complete",
      "percent": 100
    },
    "11": {
      "status": "complete",
      "percent": 100
    },
    "12": {
      "status": "complete",
      "percent": 100
    },
    "13": {
      "status": "complete",
      "percent": 100
    },
    "14": {
      "status": "complete",
      "percent": 100
    },
    "15": {
      "status": "complete",
      "percent": 100
    },
    "16": {
      "status": "complete",
      "percent": 100
    },
    "17": {
      "status": "complete",
      "percent": 100
    },
    "18": {
      "status": "complete",
      "percent": 100
    },
    "19": {
      "status": "not_started",
      "percent": 0
    },
    "13.1": {
      "status": "complete",
      "percent": 100
    },
    "18.1": {
      "status": "complete",
      "percent": 100
    },
    "18.2": {
      "status": "complete",
      "percent": 100
    },
    "18.3": {
      "status": "complete",
      "percent": 100
    },
    "18.4": {
      "status": "not_started",
      "percent": 0
    }
  },
  "implementation": {
    "nativeDaemonHttpAdapter": "verified_windows",
    "nodeBootstrapAdapter": "verified",
    "csharpBrowserWasmSpike": "verified_browser_development_and_aot",
    "engineKernel": "verified_native_and_real_wasm",
    "renderGraph": "verified_native",
    "frameProfiler": "verified_bounded_main_worker_wait_scopes_gpu_passes_history_median_mad_human_agent_exact_sessions; bounded immutable saved sessions, origin storage and JSON roundtrip",
    "projectPersistence": "verified_bootstrap_http_restart",
    "sceneEditor": "verified_ordered_closed_draggable_dock_tabs_parallel_views_modular_quick_examples_confirmed_dirty_save_shortcuts",
    "assetImport": "verified_png_glb_wav_obj_stl_step_iges_bounded_workers",
    "projectSceneRendering": "verified_chromium_software_webgpu",
    "playMode": "verified_isolated_runtime",
    "assetPipeline": "verified_incremental_cache_background_jobs_hot_reload",
    "csharpGameplay": "verified_physical_multiple_components_typed_fields_linux_dev_aot_windows_dev",
    "aiControl": "verified_named_panel_png_actual_responses_input_image_controlled_provider",
    "transactionalWorkspaces": "verified_preview_full_state_replacement_apply_autosave_failure_retention_reopen",
    "physics": "verified_native_wasm_damping_kinematic_velocity_constraints_sleep_gravity_exclusions_continuous_managed_shape_casts",
    "editableDemos": "verified_runtime_clone_selection_input_persistence_scene_resources_physics_labs",
    "causalDiagnostics": "verified_four_queries_ten_faults_scoped_graph_and_deep_trace",
    "productionRenderer": "verified_bounded_hdr_pbr_forward_plus_software_webgpu",
    "production2D": "verified_atlas_batching_tilemaps_rust_animation_particles_pixel_camera_lights_ui",
    "generalAnimation": "verified_rust_trs_skin_crossfade_state_machine_legacy_hdr_null",
    "scenePixelFiltering": "verified_nearest_independent_of_game_camera_snapping",
    "audio": "verified_web_audio_spatial_mixer_pcm_streaming_csharp_agent_null_activation",
    "gameTesting": "verified_bounded_public_isolated_fixed_step_input_runtime_collision_animation_pixel_assertions",
    "parallelViews": "verified_same_runtime_independent_cameras_scene_game_popup_input",
    "replay": "verified_bounded_input_plans_seeded_csharp_prefix_checkpoint_ranges_diagnostics",
    "entityCameras": "verified_inspector_transform_gizmos_parallel_game_and_explicit_starters",
    "aiProjectContext": "verified_manual_master_document_context_external_mcp_and_daemon_assistant; modular_pmd_planned",
    "projectFileAuthoring": "verified_portable_virtual_tree_templates_moves_copies_history_save_explorer_exports",
    "editorContextActions": "verified_scoped_clipboard_parenting_autocommit_menus_fps_and_redraw_focus",
    "lowEndPass": "verified_indexed_virtual_ui_fresh_cached_wasm_reused_gpu_storage_scale_bounded_submission",
    "editorCorrections": "verified_dockable_source_ide_exclusive_selection_project_validation_menus_ambient_fill",
    "advancedAssets": "verified_cad_tessellation_cleanup_normals_dependent_lods_generated_box_collision",
    "scriptInspector": "verified_typed_per_instance_attributes_readonly_runtime_snapshots_authoring_isolation",
    "sourceIDE": "verified_multiple_buffers_scoped_save_save_all_find_replace_reopen_center_and_play_save",
    "agentAutonomy": "verified_bounded_structured_isolated_failure_repair_retest_measured_human_review",
    "runtimeInspector": "verified_transient_attached_components_transform_typed_csharp_scrub_and_detached_focus",
    "scriptCompilation": "verified_stopped_only_shared_explicit_auto_after_stop_open_play_source_hash_sdk_identity_and_cached_valid_recovery",
    "openAiAssistant": "live_workshop_confirmed; grouped_tools_compact_checkpoints; per_request_cache_reasoning_usage; task_history_requests_xy",
    "scriptingApi": "verified_sdk6_objects_execution_physics2d_physics3d_input_scene_resources_playerprefs_partial_unity_surface"
  },
  "verified": {
    "nodeTests": {
      "passed": 395,
      "failed": 0,
      "evidenceEnvironment": "GitHub CI 303, Linux and Windows"
    },
    "schemaDocuments": 18,
    "architectureRules": 3,
    "daemonStartup": true,
    "httpStaticDelivery": true,
    "windowsChromeWebGpu": true,
    "crossOriginIsolated": true,
    "rustCoreWasmCheck": {
      "passed": true,
      "toolchain": "rustc 1.90.0",
      "target": "wasm32-unknown-unknown",
      "evidenceEnvironment": "GitHub CI 303, 0.0.47"
    },
    "csharpWasmPublish": {
      "passed": true,
      "sdkVersion": 6,
      "configurations": [
        "Linux development",
        "Linux AOT",
        "Windows development"
      ],
      "evidenceEnvironment": "GitHub CI 303",
      "note": "Runtime, gameplay and physics SDK checked in actual Wasm; trimming diagnostics may remain and are not claimed as zero warnings."
    },
    "nativeRustGate": {
      "passed": true,
      "format": "passed",
      "clippyWarnings": 0,
      "testsPassed": 44,
      "testsFailed": 0,
      "toolchain": "rustc 1.90.0",
      "evidenceEnvironment": "GitHub CI 303, rustc 1.90.0, 0.0.47"
    },
    "nativeBrowserSmoke": {
      "passed": true,
      "protocol": 1,
      "service": "axiom-daemon",
      "crossOriginIsolated": true,
      "commands": [
        "system.ping",
        "demo.increment",
        "editor.undo"
      ]
    },
    "remoteCi": {
      "passed": true,
      "status": "completed",
      "version": "0.0.47",
      "commit": "a4530dd976490de4fb7ce90eea7367d16c19d737",
      "tree": "268c1509a76d4f0d90b25542a64b7dceb0f9ea77",
      "run": 303,
      "runId": 39058085678,
      "url": "https://github.com/Krozzeo/AxiomEngine/actions/runs/39058085678",
      "jobCount": 40,
      "jobsPassed": 40,
      "pendingJobs": [],
      "jobs": [
        {
          "name": "rust",
          "conclusion": "success"
        },
        {
          "name": "csharp-wasm-spike (ubuntu-latest, aot)",
          "conclusion": "success"
        },
        {
          "name": "bootstrap (ubuntu-latest)",
          "conclusion": "success"
        },
        {
          "name": "csharp-wasm-spike (windows-latest, development)",
          "conclusion": "success"
        },
        {
          "name": "bootstrap (windows-latest)",
          "conclusion": "success"
        },
        {
          "name": "script-boundaries (macos-latest)",
          "conclusion": "success"
        },
        {
          "name": "script-boundaries (ubuntu-latest)",
          "conclusion": "success"
        },
        {
          "name": "script-boundaries (windows-latest)",
          "conclusion": "success"
        },
        {
          "name": "csharp-wasm-spike (ubuntu-latest, development)",
          "conclusion": "success"
        },
        {
          "name": "browser-milestones (m18-3-8)",
          "conclusion": "success"
        },
        {
          "name": "browser-milestones (m18-3-9)",
          "conclusion": "success"
        },
        {
          "name": "browser-milestones (m18-3-6)",
          "conclusion": "success"
        },
        {
          "name": "browser-milestones (m18-1)",
          "conclusion": "success"
        },
        {
          "name": "browser-milestones (m18-2)",
          "conclusion": "success"
        },
        {
          "name": "browser-milestones (m2)",
          "conclusion": "success"
        },
        {
          "name": "browser-milestones (m18)",
          "conclusion": "success"
        },
        {
          "name": "browser-milestones (m18-2-1)",
          "conclusion": "success"
        },
        {
          "name": "browser-milestones (m3)",
          "conclusion": "success"
        },
        {
          "name": "browser-milestones (m18-3-4)",
          "conclusion": "success"
        },
        {